{u'reviews': [{u'url': u'https://www.yelp.com/biz/red-lobster-bryan?hrid=M5Re51_TiZ_aLV7NJYdjvQ&adjust_creative=2Slx3F97ZFV4IU3uImzXaw&utm_campaign=yelp_api_v3&utm_medium=api_v3_business_reviews&utm_source=2Slx3F97ZFV4IU3uImzXaw', u'text': u'This was my first time ever to a Red Lobster, and my low expectations going in were not met. I ordered the 4 course meal. My caesar salad and lobster bisque...', u'user': {u'image_url': u'https://s3-media2.fl.yelpcdn.com/photo/eqcJzS912hw3qCI_n5eO7Q/o.jpg', u'name': u'Abby A.'}, u'time_created': u'2017-01-02 14:29:28', u'rating': 1}], u'total': 1}
{u'reviews': [{u'url': u'https://www.yelp.com/biz/mcdonalds-bryan-3?hrid=iZNP2pAuhKgdU3ijBL0dbA&adjust_creative=2Slx3F97ZFV4IU3uImzXaw&utm_campaign=yelp_api_v3&utm_medium=api_v3_business_reviews&utm_source=2Slx3F97ZFV4IU3uImzXaw', u'text': u'Okay come on now people, who is willing to admit that they were not at least interested in the new Fish McBites made from the same fish "Pollock" that is...', u'user': {u'image_url': u'https://s3-media4.fl.yelpcdn.com/photo/ZCPKbFey3OF83MI8wPdNpg/o.jpg', u'name': u'Greg D.'}, u'time_created': u'2013-03-05 19:23:02', u'rating': 1}], u'total': 1}
{u'reviews': [{u'url': u'https://www.yelp.com/biz/taqueria-esmeraldas-bryan?hrid=MXVgyAvWpuV3OLuGuC_nNg&adjust_creative=2Slx3F97ZFV4IU3uImzXaw&utm_campaign=yelp_api_v3&utm_medium=api_v3_business_reviews&utm_source=2Slx3F97ZFV4IU3uImzXaw', u'text': u"This used to be Bellon's Kung Pao Express and before it something called Krispy Krunchy Chicken.\n\nWeird taqueria in a vaguely unpleasant c-store, where you...", u'user': {u'image_url': u'https://s3-media1.fl.yelpcdn.com/photo/YDeW7uClkYULgV8gqlcJag/o.jpg', u'name': u'Imba K.'}, u'time_created': u'2016-08-27 11:13:34', u'rating': 3}], u'total': 1}
{u'reviews': [{u'url': u'https://www.yelp.com/biz/el-pollo-caliente-bryan?hrid=uOZTVBVdS0hYAg6iqCZMDA&adjust_creative=2Slx3F97ZFV4IU3uImzXaw&utm_campaign=yelp_api_v3&utm_medium=api_v3_business_reviews&utm_source=2Slx3F97ZFV4IU3uImzXaw', u'text': u'Speaking of Mexican Chicken, El Pollo Caliente (means the hot chicken) is/was(?) a mobile food stand vendor that can be found in the parking lot connected...', u'user': {u'image_url': u'https://s3-media4.fl.yelpcdn.com/photo/ZCPKbFey3OF83MI8wPdNpg/o.jpg', u'name': u'Greg D.'}, u'time_created': u'2013-03-03 10:44:05', u'rating': 4}], u'total': 1}
{u'reviews': [{u'url': u'https://www.yelp.com/biz/popeyes-louisiana-kitchen-bryan-3?hrid=k01ny_rZkjBXiB2TXsHkuw&adjust_creative=2Slx3F97ZFV4IU3uImzXaw&utm_campaign=yelp_api_v3&utm_medium=api_v3_business_reviews&utm_source=2Slx3F97ZFV4IU3uImzXaw', u'text': u'As far as fried chicken goes this location serves fresh and tasty chicken. I had a coupon for a 3 piece and biscuit and was served on a timely and friendly...', u'user': {u'image_url': u'https://s3-media3.fl.yelpcdn.com/photo/NMvS_niQHor0zE6grXpb5w/o.jpg', u'name': u'Lili C.'}, u'time_created': u'2016-07-08 18:27:28', u'rating': 4}, {u'url': u'https://www.yelp.com/biz/popeyes-louisiana-kitchen-bryan-3?hrid=KNPKVyE4k5sassWmAlMZrA&adjust_creative=2Slx3F97ZFV4IU3uImzXaw&utm_campaign=yelp_api_v3&utm_medium=api_v3_business_reviews&utm_source=2Slx3F97ZFV4IU3uImzXaw', u'text': u"How are your hours going to say you close at 10, and you're already cleaning up and not making food anymore at 9:30? Close this one and bring back the one...", u'user': {u'image_url': u'https://s3-media4.fl.yelpcdn.com/photo/ttbKS72rF_iOikWDyiZXkw/o.jpg', u'name': u'Dimitri K.'}, u'time_created': u'2014-11-01 11:11:26', u'rating': 1}, {u'url': u'https://www.yelp.com/biz/popeyes-louisiana-kitchen-bryan-3?hrid=IEWIbl81CzOmE8ywgwGVkw&adjust_creative=2Slx3F97ZFV4IU3uImzXaw&utm_campaign=yelp_api_v3&utm_medium=api_v3_business_reviews&utm_source=2Slx3F97ZFV4IU3uImzXaw', u'text': u'I have tried to get their shrimp several times, however every time i go to Popeyes, there are out of the jumbo and regular shrimp. I have gone there and...', u'user': {u'image_url': u'https://s3-media4.fl.yelpcdn.com/photo/epuPtYNF87tgXbZ1CQc9qw/o.jpg', u'name': u'Patricia F.'}, u'time_created': u'2014-12-04 12:40:05', u'rating': 1}], u'total': 4}
{u'reviews': [{u'url': u'https://www.yelp.com/biz/little-caesars-pizza-bryan-2?hrid=waK_p1GdNLOeXAX7GL5PXg&adjust_creative=2Slx3F97ZFV4IU3uImzXaw&utm_campaign=yelp_api_v3&utm_medium=api_v3_business_reviews&utm_source=2Slx3F97ZFV4IU3uImzXaw', u'text': u"The girl was so high she looked at us stupid, and asked muiltiple times what we were wanting.\nShe was clueless. And who sells wings and doesn't have a...", u'user': {u'image_url': u'https://s3-media1.fl.yelpcdn.com/photo/1vd1eOuoZviVyJ8fCF7kpg/o.jpg', u'name': u'Misty G.'}, u'time_created': u'2017-05-22 15:14:33', u'rating': 1}, {u'url': u'https://www.yelp.com/biz/little-caesars-pizza-bryan-2?hrid=LRXiQnCyIaHJr5lthdrseQ&adjust_creative=2Slx3F97ZFV4IU3uImzXaw&utm_campaign=yelp_api_v3&utm_medium=api_v3_business_reviews&utm_source=2Slx3F97ZFV4IU3uImzXaw', u'text': u"Unlike Greg, I don't pretend to be some fancy reviewer who concerns himself with where they get their food supply from. I don't think I'm better than most...", u'user': {u'image_url': u'https://s3-media2.fl.yelpcdn.com/photo/E7mEe6Toi_W_tGsvJil4UQ/o.jpg', u'name': u'Rich J.'}, u'time_created': u'2016-02-07 00:51:06', u'rating': 5}, {u'url': u'https://www.yelp.com/biz/little-caesars-pizza-bryan-2?hrid=6KmEYiRdn3WqNivDKerABQ&adjust_creative=2Slx3F97ZFV4IU3uImzXaw&utm_campaign=yelp_api_v3&utm_medium=api_v3_business_reviews&utm_source=2Slx3F97ZFV4IU3uImzXaw', u'text': u"Was surprised to see a new Little Caesars open up in the UPS store building so picked up a $5 carry out.   Ah darn.   I forgot why I won't do $5 carry outs...", u'user': {u'image_url': u'https://s3-media4.fl.yelpcdn.com/photo/ZCPKbFey3OF83MI8wPdNpg/o.jpg', u'name': u'Greg D.'}, u'time_created': u'2012-03-08 19:39:34', u'rating': 2}], u'total': 4}
{u'reviews': [{u'url': u'https://www.yelp.com/biz/hillcrest-grocery-taqueria-bryan?hrid=jCt24k5YV1kGO-p0LM3hog&adjust_creative=2Slx3F97ZFV4IU3uImzXaw&utm_campaign=yelp_api_v3&utm_medium=api_v3_business_reviews&utm_source=2Slx3F97ZFV4IU3uImzXaw', u'text': u"In my opinion, the best tacos in Bryan.  A good selection...and a homemade hot sauce that's  very addictive. They also have other food...Crispy Crunchy...", u'user': {u'image_url': u'https://s3-media4.fl.yelpcdn.com/photo/J19eqZchCar73nigUuaNpg/o.jpg', u'name': u'Bruce J.'}, u'time_created': u'2017-05-02 13:15:13', u'rating': 5}], u'total': 1}
{u'reviews': [{u'url': u'https://www.yelp.com/biz/taqueria-regiomontana-bryan-2?hrid=1jzX9MJ_8QlQocnFJ7ODxQ&adjust_creative=2Slx3F97ZFV4IU3uImzXaw&utm_campaign=yelp_api_v3&utm_medium=api_v3_business_reviews&utm_source=2Slx3F97ZFV4IU3uImzXaw', u'text': u'When visiting the exact same Taqueria Regiomontana trailer just down the street in the Hillcrest Grocery store parking lot this past summer, according to my...', u'user': {u'image_url': u'https://s3-media4.fl.yelpcdn.com/photo/ZCPKbFey3OF83MI8wPdNpg/o.jpg', u'name': u'Greg D.'}, u'time_created': u'2010-01-25 07:16:21', u'rating': 1}], u'total': 1}
{u'reviews': [{u'url': u'https://www.yelp.com/biz/jack-in-the-box-bryan-2?hrid=BMrbtflxr_2snwJssYWp9g&adjust_creative=2Slx3F97ZFV4IU3uImzXaw&utm_campaign=yelp_api_v3&utm_medium=api_v3_business_reviews&utm_source=2Slx3F97ZFV4IU3uImzXaw', u'text': u'If I could give a zero I would. The service was pretty appalling. And I guess I should have gone with my gut.\nNo body was in the parking lot or even in the...', u'user': {u'image_url': u'https://s3-media3.fl.yelpcdn.com/photo/jCkYGQOBqw0R9jw7VSqmAw/o.jpg', u'name': u'Rigel C.'}, u'time_created': u'2016-09-09 03:11:06', u'rating': 1}, {u'url': u'https://www.yelp.com/biz/jack-in-the-box-bryan-2?hrid=K1MiXVdd2cl3OfhNNgmSpA&adjust_creative=2Slx3F97ZFV4IU3uImzXaw&utm_campaign=yelp_api_v3&utm_medium=api_v3_business_reviews&utm_source=2Slx3F97ZFV4IU3uImzXaw', u'text': u"I only go here when it's late, the line at Whataburger is too long, and I don't feel like driving anywhere else. The service is usually unimpressive at...", u'user': {u'image_url': u'https://s3-media3.fl.yelpcdn.com/photo/yiuTFk2F36qF5mBJfcEhGA/o.jpg', u'name': u'Grayson T.'}, u'time_created': u'2016-06-20 16:58:36', u'rating': 1}, {u'url': u'https://www.yelp.com/biz/jack-in-the-box-bryan-2?hrid=-N_8TdCTOwOBME1Y7h848g&adjust_creative=2Slx3F97ZFV4IU3uImzXaw&utm_campaign=yelp_api_v3&utm_medium=api_v3_business_reviews&utm_source=2Slx3F97ZFV4IU3uImzXaw', u'text': u'Here they always confuse my order. Besides it suppose to be a fast food place but it is not fast at all. \nDo not recommend.', u'user': {u'image_url': u'https://s3-media3.fl.yelpcdn.com/photo/n5WLHgbSdtyTXcwkrzaj9A/o.jpg', u'name': u'Arturo R.'}, u'time_created': u'2016-03-12 16:21:24', u'rating': 1}], u'total': 6}
{u'error': {u'code': u'BUSINESS_UNAVAILABLE', u'description': u'We may not be able to provide details for certain businesses, for example if they do not have any reviews yet.'}}
{u'error': {u'code': u'BUSINESS_UNAVAILABLE', u'description': u'We may not be able to provide details for certain businesses, for example if they do not have any reviews yet.'}}
{u'reviews': [{u'url': u'https://www.yelp.com/biz/taqueria-las-mexicanas-truck-bryan?hrid=S7Ed1hgfHQ8HXjoQhTBHAw&adjust_creative=2Slx3F97ZFV4IU3uImzXaw&utm_campaign=yelp_api_v3&utm_medium=api_v3_business_reviews&utm_source=2Slx3F97ZFV4IU3uImzXaw', u'text': u"Awesome food! Certain meats (chicken, for example) sell out quickly but it doesn't matter much because the other options are all great! Tacos and...", u'user': {u'image_url': u'https://s3-media1.fl.yelpcdn.com/photo/RQ0tIgrv_XujnXESSRwhOw/o.jpg', u'name': u'Joshua F.'}, u'time_created': u'2016-12-17 12:39:22', u'rating': 5}, {u'url': u'https://www.yelp.com/biz/taqueria-las-mexicanas-truck-bryan?hrid=eFVviWFySx6nI-mBGu9NVA&adjust_creative=2Slx3F97ZFV4IU3uImzXaw&utm_campaign=yelp_api_v3&utm_medium=api_v3_business_reviews&utm_source=2Slx3F97ZFV4IU3uImzXaw', u'text': u"Who knew that our -favorite- Taqueria in Brazos Valley also had a food truck?  Apparently they have had it for two years and it's in the Ready 2 Go parking...", u'user': {u'image_url': u'https://s3-media4.fl.yelpcdn.com/photo/ZCPKbFey3OF83MI8wPdNpg/o.jpg', u'name': u'Greg D.'}, u'time_created': u'2011-05-06 21:18:39', u'rating': 5}], u'total': 2}
{u'reviews': [{u'url': u'https://www.yelp.com/biz/subway-bryan-7?hrid=Rtu9CcryGUP0KQwnoOQJYQ&adjust_creative=2Slx3F97ZFV4IU3uImzXaw&utm_campaign=yelp_api_v3&utm_medium=api_v3_business_reviews&utm_source=2Slx3F97ZFV4IU3uImzXaw', u'text': u'Food is just the same as any other Subway, a sandwich longer than compensating for width, girth weight or ingredients (The Five Dalla Foot Loong!), yet it...', u'user': {u'image_url': u'https://s3-media4.fl.yelpcdn.com/photo/ZCPKbFey3OF83MI8wPdNpg/o.jpg', u'name': u'Greg D.'}, u'time_created': u'2013-10-21 13:38:34', u'rating': 3}], u'total': 1}
{u'error': {u'code': u'BUSINESS_UNAVAILABLE', u'description': u'We may not be able to provide details for certain businesses, for example if they do not have any reviews yet.'}}
{u'reviews': [{u'url': u'https://www.yelp.com/biz/la-jefa-taqueria-bryan?hrid=ueVGham81EtgqPYAlBpveQ&adjust_creative=2Slx3F97ZFV4IU3uImzXaw&utm_campaign=yelp_api_v3&utm_medium=api_v3_business_reviews&utm_source=2Slx3F97ZFV4IU3uImzXaw', u'text': u'Well, the third time was a charm, finally being able to eat here.  Went by Saturday only to learn it closed at 2 pm.   (Should have made note of the hours...', u'user': {u'image_url': u'https://s3-media4.fl.yelpcdn.com/photo/ZCPKbFey3OF83MI8wPdNpg/o.jpg', u'name': u'Greg D.'}, u'time_created': u'2013-10-14 15:39:29', u'rating': 3}], u'total': 1}
{u'reviews': [{u'url': u'https://www.yelp.com/biz/mcdonalds-bryan?hrid=CRclbzuJ8IJm8XnLkB1XQg&adjust_creative=2Slx3F97ZFV4IU3uImzXaw&utm_campaign=yelp_api_v3&utm_medium=api_v3_business_reviews&utm_source=2Slx3F97ZFV4IU3uImzXaw', u'text': u"This location recently got new owners who live in the area, and there's definitely an evident change in the way things are running here.", u'user': {u'image_url': u'https://s3-media3.fl.yelpcdn.com/photo/1dWjuBeNaZWA1tos9XL1fA/o.jpg', u'name': u'Rose Z.'}, u'time_created': u'2017-02-02 08:59:56', u'rating': 5}, {u'url': u'https://www.yelp.com/biz/mcdonalds-bryan?hrid=2ZIIT7W3OEsLvHNdJWSv9A&adjust_creative=2Slx3F97ZFV4IU3uImzXaw&utm_campaign=yelp_api_v3&utm_medium=api_v3_business_reviews&utm_source=2Slx3F97ZFV4IU3uImzXaw', u'text': u"Because Ashley's Soft serve ice cream thread gave me a hankering for soft serve, I went to this McDonald's for the first time.  \n\nI walked in to see 3...", u'user': {u'image_url': u'https://s3-media4.fl.yelpcdn.com/photo/-E-jJDdWLTV9wes3m0WFrQ/o.jpg', u'name': u'Ba L.'}, u'time_created': u'2008-11-09 10:54:37', u'rating': 1}], u'total': 2}
{u'reviews': [{u'url': u'https://www.yelp.com/biz/el-cowboy-taco-ntento-bryan?hrid=GOLVcRQJpXmVcfMUF789jA&adjust_creative=2Slx3F97ZFV4IU3uImzXaw&utm_campaign=yelp_api_v3&utm_medium=api_v3_business_reviews&utm_source=2Slx3F97ZFV4IU3uImzXaw', u'text': u"Bryan, we have a new taqueria.  Noticed this place today when headed to Shannon's for lunch.  Bummer to see the demise of L&L, especially why it closed, but...", u'user': {u'image_url': u'https://s3-media4.fl.yelpcdn.com/photo/ZCPKbFey3OF83MI8wPdNpg/o.jpg', u'name': u'Greg D.'}, u'time_created': u'2014-03-08 18:45:05', u'rating': 5}], u'total': 1}
{u'reviews': [{u'url': u'https://www.yelp.com/biz/wendys-bryan?hrid=mbh6UWqKWtZC0nvQJwjrJA&adjust_creative=2Slx3F97ZFV4IU3uImzXaw&utm_campaign=yelp_api_v3&utm_medium=api_v3_business_reviews&utm_source=2Slx3F97ZFV4IU3uImzXaw', u'text': u"Every so often I get a hankerin for the Asiago chicken sandwich and chocolate frosty from Wendy's and I typically go to the Wendy's in College Station but...", u'user': {u'image_url': None, u'name': u'Christine R.'}, u'time_created': u'2016-12-29 12:06:25', u'rating': 1}, {u'url': u'https://www.yelp.com/biz/wendys-bryan?hrid=9WCoPU3aUk_6MPJLvShNhQ&adjust_creative=2Slx3F97ZFV4IU3uImzXaw&utm_campaign=yelp_api_v3&utm_medium=api_v3_business_reviews&utm_source=2Slx3F97ZFV4IU3uImzXaw', u'text': u'Rude and ghetto!!  We asked if they had potatoes when we went through the drive through tonight.  The manager came on the speaker and said "hi im the...', u'user': {u'image_url': u'https://s3-media3.fl.yelpcdn.com/photo/akRjPvMKUpY-Cpm5wRuFtw/o.jpg', u'name': u'Amy R.'}, u'time_created': u'2016-11-03 18:02:43', u'rating': 1}, {u'url': u'https://www.yelp.com/biz/wendys-bryan?hrid=_wOZYhChAC6i0iHW9jdDWA&adjust_creative=2Slx3F97ZFV4IU3uImzXaw&utm_campaign=yelp_api_v3&utm_medium=api_v3_business_reviews&utm_source=2Slx3F97ZFV4IU3uImzXaw', u'text': u'Went got the baconator today was totally disappointed. The picture shows bacon hanging out over the meat and outside the bun. Well that is not what mine...', u'user': {u'image_url': None, u'name': u'ALLAN G.'}, u'time_created': u'2016-09-10 17:51:42', u'rating': 1}], u'total': 4}
{u'reviews': [{u'url': u'https://www.yelp.com/biz/burger-king-bryan-3?hrid=lJKfyN9p_g_oF0gTKL4nAQ&adjust_creative=2Slx3F97ZFV4IU3uImzXaw&utm_campaign=yelp_api_v3&utm_medium=api_v3_business_reviews&utm_source=2Slx3F97ZFV4IU3uImzXaw', u'text': u"Haven't been to Burger King in years. Accidentally passed McDonald's, just needed a quick road snack. People were rude, which is fine because it's fast...", u'user': {u'image_url': u'https://s3-media3.fl.yelpcdn.com/photo/Y51mIveoiZ5ZeewTFv0_DQ/o.jpg', u'name': u'Miranda L.'}, u'time_created': u'2016-06-03 16:08:56', u'rating': 1}, {u'url': u'https://www.yelp.com/biz/burger-king-bryan-3?hrid=bOmLXi9mtkw9Mf4mhZrxfg&adjust_creative=2Slx3F97ZFV4IU3uImzXaw&utm_campaign=yelp_api_v3&utm_medium=api_v3_business_reviews&utm_source=2Slx3F97ZFV4IU3uImzXaw', u'text': u'Being a Whopper lover and having one at least once a month, I was surprised to find this new Burger King.   The Hiway 6 exit sign at 21 now shows a Burger...', u'user': {u'image_url': u'https://s3-media4.fl.yelpcdn.com/photo/ZCPKbFey3OF83MI8wPdNpg/o.jpg', u'name': u'Greg D.'}, u'time_created': u'2009-09-15 21:17:30', u'rating': 3}], u'total': 2}
{u'error': {u'code': u'BUSINESS_UNAVAILABLE', u'description': u'We may not be able to provide details for certain businesses, for example if they do not have any reviews yet.'}}
{u'error': {u'code': u'BUSINESS_UNAVAILABLE', u'description': u'We may not be able to provide details for certain businesses, for example if they do not have any reviews yet.'}}
{u'error': {u'code': u'BUSINESS_UNAVAILABLE', u'description': u'We may not be able to provide details for certain businesses, for example if they do not have any reviews yet.'}}
{u'reviews': [{u'url': u'https://www.yelp.com/biz/sonic-drive-in-bryan?hrid=uqDUJfCFa79wbvuqWT_Gcw&adjust_creative=2Slx3F97ZFV4IU3uImzXaw&utm_campaign=yelp_api_v3&utm_medium=api_v3_business_reviews&utm_source=2Slx3F97ZFV4IU3uImzXaw', u'text': u'Poor customer service! My wife and I sat at our stall for over 5 minutes while the employees hung around outside with their friends. They knew we were...', u'user': {u'image_url': u'https://s3-media4.fl.yelpcdn.com/photo/_LhLUq5s3WUBcd4nDs9mCQ/o.jpg', u'name': u'Angel S.'}, u'time_created': u'2017-02-06 17:27:56', u'rating': 1}, {u'url': u'https://www.yelp.com/biz/sonic-drive-in-bryan?hrid=4QCvucBtO42HUPSuhMQ0fg&adjust_creative=2Slx3F97ZFV4IU3uImzXaw&utm_campaign=yelp_api_v3&utm_medium=api_v3_business_reviews&utm_source=2Slx3F97ZFV4IU3uImzXaw', u'text': u"Never ever come through here!!!  Waited and the stupid speaker for my order to be taken... They never asked. Finally drove up to the window, and there's 6...", u'user': {u'image_url': u'https://s3-media2.fl.yelpcdn.com/photo/SD-3v2PfbeishFGR-3vVmA/o.jpg', u'name': u'SukiLeiRu M.'}, u'time_created': u'2016-06-19 15:13:57', u'rating': 1}, {u'url': u'https://www.yelp.com/biz/sonic-drive-in-bryan?hrid=IwAudH9cpHxVKxQyezuDBA&adjust_creative=2Slx3F97ZFV4IU3uImzXaw&utm_campaign=yelp_api_v3&utm_medium=api_v3_business_reviews&utm_source=2Slx3F97ZFV4IU3uImzXaw', u'text': u"I hate this Sonic, but it is so close to my house.  I go here every 6-36 months when I'm in dire need of a burger and fries.  It takes about 6 months for me...", u'user': {u'image_url': u'https://s3-media4.fl.yelpcdn.com/photo/-E-jJDdWLTV9wes3m0WFrQ/o.jpg', u'name': u'Ba L.'}, u'time_created': u'2008-11-09 10:44:15', u'rating': 1}], u'total': 3}
{u'reviews': [{u'url': u'https://www.yelp.com/biz/seafood-house-bryan?hrid=-OgXC9BKkdy4Jv02T3DWlQ&adjust_creative=2Slx3F97ZFV4IU3uImzXaw&utm_campaign=yelp_api_v3&utm_medium=api_v3_business_reviews&utm_source=2Slx3F97ZFV4IU3uImzXaw', u'text': u'This is a small seafood restaurant on San Jacinto, Which IS Hwy 21 through part of northwest Bryan. They have a slogan on the sign which reads "You Buy We...', u'user': {u'image_url': u'https://s3-media3.fl.yelpcdn.com/photo/d5OUJHmeee5XMNY1yY1Vtw/o.jpg', u'name': u'ed y.'}, u'time_created': u'2009-04-30 06:08:06', u'rating': 2}], u'total': 1}
{u'reviews': [{u'url': u'https://www.yelp.com/biz/seafood-house-bryan?hrid=-OgXC9BKkdy4Jv02T3DWlQ&adjust_creative=2Slx3F97ZFV4IU3uImzXaw&utm_campaign=yelp_api_v3&utm_medium=api_v3_business_reviews&utm_source=2Slx3F97ZFV4IU3uImzXaw', u'text': u'This is a small seafood restaurant on San Jacinto, Which IS Hwy 21 through part of northwest Bryan. They have a slogan on the sign which reads "You Buy We...', u'user': {u'image_url': u'https://s3-media3.fl.yelpcdn.com/photo/d5OUJHmeee5XMNY1yY1Vtw/o.jpg', u'name': u'ed y.'}, u'time_created': u'2009-04-30 06:08:06', u'rating': 2}], u'total': 1}
{u'error': {u'code': u'BUSINESS_UNAVAILABLE', u'description': u'We may not be able to provide details for certain businesses, for example if they do not have any reviews yet.'}}
{u'error': {u'code': u'BUSINESS_UNAVAILABLE', u'description': u'We may not be able to provide details for certain businesses, for example if they do not have any reviews yet.'}}
{u'error': {u'code': u'BUSINESS_UNAVAILABLE', u'description': u'We may not be able to provide details for certain businesses, for example if they do not have any reviews yet.'}}
{u'reviews': [{u'url': u'https://www.yelp.com/biz/taqueria-mexico-bryan-2?hrid=RhG2YirId6e8nU27iTqTPg&adjust_creative=2Slx3F97ZFV4IU3uImzXaw&utm_campaign=yelp_api_v3&utm_medium=api_v3_business_reviews&utm_source=2Slx3F97ZFV4IU3uImzXaw', u'text': u"This has gone out of business.  \n\nThe entire building and fences have been repainted in some extremely bright colors and there's a new sign of a new...", u'user': {u'image_url': u'https://s3-media4.fl.yelpcdn.com/photo/ZCPKbFey3OF83MI8wPdNpg/o.jpg', u'name': u'Greg D.'}, u'time_created': u'2014-05-15 19:19:29', u'rating': 1}, {u'url': u'https://www.yelp.com/biz/taqueria-mexico-bryan-2?hrid=oGS60_1Xg9nIukz7AnCeyw&adjust_creative=2Slx3F97ZFV4IU3uImzXaw&utm_campaign=yelp_api_v3&utm_medium=api_v3_business_reviews&utm_source=2Slx3F97ZFV4IU3uImzXaw', u'text': u'Changed ownership. I ate here once a week under the old owners to the point they would put in my order and I knew it would be 5.40 each time. Used to be my...', u'user': {u'image_url': None, u'name': u'Caleb C.'}, u'time_created': u'2012-01-21 11:08:32', u'rating': 2}, {u'url': u'https://www.yelp.com/biz/taqueria-mexico-bryan-2?hrid=IDIe0VZdqnIQTNxoo-uIaQ&adjust_creative=2Slx3F97ZFV4IU3uImzXaw&utm_campaign=yelp_api_v3&utm_medium=api_v3_business_reviews&utm_source=2Slx3F97ZFV4IU3uImzXaw', u'text': u'There seems to be some confusion with this location. Yelp has a listing with the name Taqueria Mexico at the wrong address & phone #. This may be because...', u'user': {u'image_url': u'https://s3-media3.fl.yelpcdn.com/photo/d5OUJHmeee5XMNY1yY1Vtw/o.jpg', u'name': u'ed y.'}, u'time_created': u'2009-02-25 01:36:06', u'rating': 5}], u'total': 3}
{u'reviews': [{u'url': u'https://www.yelp.com/biz/dairy-queen-bryan-5?hrid=Jwy7-YPk_pcrIQr_5PCmfg&adjust_creative=2Slx3F97ZFV4IU3uImzXaw&utm_campaign=yelp_api_v3&utm_medium=api_v3_business_reviews&utm_source=2Slx3F97ZFV4IU3uImzXaw', u'text': u"The hamburgers were great. I also ordered a banana split for my son and it's nothing compared to the picture they advertise. I asked the lady to charge me...", u'user': {u'image_url': None, u'name': u'Gerardo G.'}, u'time_created': u'2017-06-07 12:22:50', u'rating': 1}, {u'url': u'https://www.yelp.com/biz/dairy-queen-bryan-5?hrid=trvi0ucpAtsRkwZHbW5wZg&adjust_creative=2Slx3F97ZFV4IU3uImzXaw&utm_campaign=yelp_api_v3&utm_medium=api_v3_business_reviews&utm_source=2Slx3F97ZFV4IU3uImzXaw', u'text': u'This DQ has decent service. The chicken fingers are ALWAYS fresh. You have to wait a few minutes usually but it is definitely worth it.', u'user': {u'image_url': u'https://s3-media1.fl.yelpcdn.com/photo/bEPhGKiQkwddiJXdncx29Q/o.jpg', u'name': u'Ashlei B.'}, u'time_created': u'2015-03-25 16:25:12', u'rating': 5}, {u'url': u'https://www.yelp.com/biz/dairy-queen-bryan-5?hrid=JvOCQ5tV4NtaP6-PCpqAHA&adjust_creative=2Slx3F97ZFV4IU3uImzXaw&utm_campaign=yelp_api_v3&utm_medium=api_v3_business_reviews&utm_source=2Slx3F97ZFV4IU3uImzXaw', u'text': u'They are lucky I am giving them a star. They messed up my dipped cone and instead of making me a new they redipped it into the chocolate. Then I order a...', u'user': {u'image_url': None, u'name': u'Race G.'}, u'time_created': u'2014-08-29 16:58:54', u'rating': 1}], u'total': 3}
{u'reviews': [{u'url': u'https://www.yelp.com/biz/taqueria-el-nopalito-bryan?hrid=OM-GYoBI4aiVVAX_7JF7jw&adjust_creative=2Slx3F97ZFV4IU3uImzXaw&utm_campaign=yelp_api_v3&utm_medium=api_v3_business_reviews&utm_source=2Slx3F97ZFV4IU3uImzXaw', u'text': u"They have the best Mexican street food I've had at College Station by far! It's also very decently priced. We tried the ground beef tacos which can fit the...", u'user': {u'image_url': u'https://s3-media1.fl.yelpcdn.com/photo/tG5LVr51qpD6APPH9JquoA/o.jpg', u'name': u'Jasmine Y.'}, u'time_created': u'2017-02-27 11:35:37', u'rating': 5}, {u'url': u'https://www.yelp.com/biz/taqueria-el-nopalito-bryan?hrid=p6uJcGGXV77EE57Kn7nL0g&adjust_creative=2Slx3F97ZFV4IU3uImzXaw&utm_campaign=yelp_api_v3&utm_medium=api_v3_business_reviews&utm_source=2Slx3F97ZFV4IU3uImzXaw', u'text': u'Great food, great prices! I love the simplicity of their menu. They have tortas, gorditas, tacos, quesadillas and you choose your preferred meat. They also...', u'user': {u'image_url': u'https://s3-media3.fl.yelpcdn.com/photo/NMvS_niQHor0zE6grXpb5w/o.jpg', u'name': u'Lili C.'}, u'time_created': u'2017-04-18 21:29:46', u'rating': 5}, {u'url': u'https://www.yelp.com/biz/taqueria-el-nopalito-bryan?hrid=SZDT8ZHOIgdhFEH2vxsECQ&adjust_creative=2Slx3F97ZFV4IU3uImzXaw&utm_campaign=yelp_api_v3&utm_medium=api_v3_business_reviews&utm_source=2Slx3F97ZFV4IU3uImzXaw', u'text': u'Located in Bryan just off main street on MLK tacos are good wish they offered at least 2 types of salsa red or green. The juice place behind it makes for a...', u'user': {u'image_url': u'https://s3-media4.fl.yelpcdn.com/photo/iTZjZzhMLpSmH2G6jFZ3kg/o.jpg', u'name': u'TigerLily M.'}, u'time_created': u'2017-05-31 21:24:48', u'rating': 4}], u'total': 10}
{u'reviews': [{u'url': u'https://www.yelp.com/biz/bubbas-bar-and-bbq-bryan?hrid=TJrqC7prELMpkOfPu27rBQ&adjust_creative=2Slx3F97ZFV4IU3uImzXaw&utm_campaign=yelp_api_v3&utm_medium=api_v3_business_reviews&utm_source=2Slx3F97ZFV4IU3uImzXaw', u'text': u"It's.a hole in the wall but they have some great ribs.   It's called something else now though.  Miss Helen's Cafe or something.   Nice people and good food.", u'user': {u'image_url': u'https://s3-media1.fl.yelpcdn.com/photo/ZmwBnCC2Ap0OVdAoYANZSA/o.jpg', u'name': u'John D.'}, u'time_created': u'2017-01-14 13:29:42', u'rating': 5}], u'total': 1}
